{
  "type": "object",
  "additionalProperties": false,
  "required": [
    "schema_version",
    "id",
    "revision",
    "plan_hash",
    "repository_commits",
    "dependency_bindings",
    "hash"
  ],
  "properties": {
    "schema_version": {
      "const": "0.1"
    },
    "id": {
      "type": "string",
      "minLength": 1
    },
    "revision": {
      "type": "integer",
      "minimum": 1
    },
    "plan_hash": {
      "type": "string",
      "pattern": "^sha256:[a-f0-9]{64}$"
    },
    "repository_commits": {
      "type": "object",
      "minProperties": 1,
      "propertyNames": {
        "type": "string",
        "minLength": 1
      },
      "additionalProperties": {
        "type": "string",
        "pattern": "^(?:[a-f0-9]{40}|[a-f0-9]{64})$"
      }
    },
    "dependency_bindings": {
      "type": "object",
      "minProperties": 0,
      "propertyNames": {
        "type": "string",
        "minLength": 1
      },
      "additionalProperties": {
        "type": "string",
        "minLength": 1
      }
    },
    "hash": {
      "type": "string",
      "pattern": "^sha256:[a-f0-9]{64}$"
    }
  },
  "$schema": "https://json-schema.org/draft/2020-12/schema",
  "$id": "urn:luuna:candidate-set:0.1",
  "title": "Luuna candidate-set contract"
}
